{
  "version": "2.0",
  "project_id": "foxconn-core-values-course",
  "source_script_sha256": "sha256:94608c27f922d02eecdf23fc798773f297f7076e31760f0cd103f49db0a3022e",
  "extracted_by": "clp_director_animated_explainer",
  "candidates": {
    "characters": [
      {
        "name": "Amy",
        "frequency": 17,
        "suggested_role": "訓練部門資深培訓講師 / 課程主持人",
        "context_snippets": [
          "AMY，穿著俐落的商務套裝，專業且充滿熱情地面對學員。身後展示著鴻海Logo與六大核心價值",
          "各位同仁好，我是訓練部門的 Amy，歡迎參加鴻海六大核心價值系列課程",
          "第一個單元要探討的是「誠信」！大家在工作中有沒有碰過那種灰色地帶？",
          "第二單元「勤奮」！我們常聽到把事情做完，但做完和把事情做好，真的有一樣嗎？",
          "六大核心價值不是冰冷的規範，而是陪伴我們在每一個工作現場、每一個關鍵時刻做出正確抉擇的北極星！"
        ]
      },
      {
        "name": "Mike",
        "frequency": 56,
        "suggested_role": "研發暨營運部門主管 (經理/協理)",
        "context_snippets": [
          "部門主管MIKE、資深同仁TOM和SOPHIA、新人TINA圍坐在會議桌旁",
          "Mike，我這幾天整理H客戶的付款記錄，發現他們去年有筆訂單選了免稅模式，但付款時卻還是付了稅金",
          "你們的考量都有道理。這筆錢是客戶的疏忽，只要我們沒放自己口袋，應該不算違規",
          "等一下！這筆款項本來就不屬於我們部門，哪怕客戶沒發現，也不該直接轉成公積金",
          "身為主管，我必須嚴肅地說，這種本位主義只看自己的目標，把困難丟給別人，絕不是敏捷！"
        ]
      },
      {
        "name": "Tina",
        "frequency": 47,
        "suggested_role": "專案新人管理師 / 工程師",
        "context_snippets": [
          "新人TINA圍坐在會議桌旁，氣氛融洽",
          "可是這是客戶的錢？現在兩邊都已經關帳了，根本沒人理了！",
          "那我們需要主動通知業務窗口或是財務部嗎？",
          "我們既然發現了帳目上的誤差，主動退回並說明清楚，才是維護公司誠信的做法",
          "林工程師，這是一張急單，而且是我們的重點客戶，你們今天一定要插單排進去！"
        ]
      },
      {
        "name": "Tom",
        "frequency": 53,
        "suggested_role": "資深專案工程師 / 技術骨幹",
        "context_snippets": [
          "資深同仁TOM和SOPHIA圍坐在會議桌旁",
          "什麼？客戶多付錢，卻沒有人發現，有這麼好康的事？",
          "我看...就把它轉成部門公積金，年底辦場聚餐慰勞大家吧！",
          "沒關係啦，當初這個專案超累的，現在多請我們吃頓飯也不為過啊！",
          "如果我們把這個任務拆解，先建立自動化排程演算法，後續就能節省大量重工時間！"
        ]
      },
      {
        "name": "Sophia",
        "frequency": 43,
        "suggested_role": "資深營運分析師 / 跨部門協調專家",
        "context_snippets": [
          "資深同仁SOPHIA圍坐在會議桌旁",
          "我也覺得多一事不如少一事。這筆錢拖了這麼久，如果忽然通知，可能會被質疑我們流程有問題",
          "既然是誠信，我們就應該建立標準退款SOP，把流程透明化，讓以後的人有所依循",
          "這不只是改一個數字，而是在全球供應鏈與ESG合規架構下，確保企業長青的基石",
          "Sophia在此時順勢拿出平板，向Sam展示鴻海提出的互利合作模組與風險分擔數據"
        ]
      },
      {
        "name": "Sam",
        "frequency": 5,
        "suggested_role": "關鍵合作夥伴 / 大海科技總經理",
        "context_snippets": [
          "SAM：(面露難色)這...這太突然了。這種材料成本高，製程改變也大，明年要導入有困難啊",
          "話是這麼說，但投入這麼大，萬一回收不了怎麼辦？",
          "哈哈，Mike，您真是有備而來啊！連接下來的三步都先想好了！"
        ]
      },
      {
        "name": "Victor",
        "frequency": 3,
        "suggested_role": "供應商資深技術協理 (大海科技技術負責人)",
        "context_snippets": [
          "VICTOR：這不是想不想的問題。如果沒有鴻海的技術支援或充分的緩衝時間，我們承擔不起這個風險啊",
          "鴻海這次太不尊重人了，簡直把我們當工具，完全沒考慮我們的困難，這樣的夥伴關係，還能走多遠？",
          "商機是看到了，但如果良率拉不上來，做越多虧越多，風險還是太高了"
        ]
      },
      {
        "name": "陳總",
        "frequency": 4,
        "suggested_role": "主要客戶高階決策主管 / 總經理",
        "context_snippets": [
          "陳總在劇本中作為重要利害關係人，代表關鍵業務決策與合規稽核把關"
        ]
      },
      {
        "name": "稽核員",
        "frequency": 4,
        "suggested_role": "全球法務內部獨立稽核專員",
        "context_snippets": [
          "稽核員在劇本中作為重要利害關係人，代表關鍵業務決策與合規稽核把關"
        ]
      }
    ],
    "locations": [
      {
        "name": "主培訓演播室",
        "frequency": 16,
        "context_snippets": [
          "AMY在專業主演播室面對學員，身後展示著鴻海Logo與六大核心價值動態背景",
          "回到主講台，Amy為學員總結本單元的核心行為指標與日常實踐守則"
        ]
      },
      {
        "name": "部門核心會議室",
        "frequency": 24,
        "context_snippets": [
          "部門主管MIKE、資深同仁TOM和SOPHIA、新人TINA圍坐在會議桌旁",
          "會議室內的大白板上貼滿了便利貼與專案排程甘特圖"
        ]
      },
      {
        "name": "主管獨立辦公室",
        "frequency": 8,
        "context_snippets": [
          "Mike在自己的辦公室內審閱跨部門提案與考核報表",
          "Tina走進Mike的辦公室，就客戶帳務處理進行一對一請益"
        ]
      },
      {
        "name": "團隊開放辦公區",
        "frequency": 12,
        "context_snippets": [
          "Tom與Tina在開放辦公桌前激烈討論自動化程式碼與排程衝突",
          "夜晚的辦公區依然燈火通明，顯現出勤奮與忙碌的鮮明對比"
        ]
      },
      {
        "name": "員工休憩咖啡廳與走廊茶水間",
        "frequency": 7,
        "context_snippets": [
          "Tina和Sophia在茶水間拿著馬克杯，討論跨部門協作的痛點",
          "走廊電視牆正輪播著全球廠區的永續成就與最新ESG指標"
        ]
      },
      {
        "name": "大海科技合作夥伴會議室",
        "frequency": 4,
        "context_snippets": [
          "鴻海團隊拜訪大海科技，與Sam、Victor展開合作模式商討",
          "投影幕上清晰呈現新材料製程導入的時間表與效益評估"
        ]
      },
      {
        "name": "全球法務稽核專用會議室",
        "frequency": 3,
        "context_snippets": [
          "稽核室內桌上整齊堆放著過去數季的憑證與調查卷宗",
          "調查人員嚴肅核對客戶多付稅金與部門未報備帳目"
        ]
      }
    ],
    "props": [
      {
        "name": "H客戶多付稅金對帳單",
        "frequency": 6,
        "context_snippets": [
          "Tina手持H客戶付款記錄單據，指著多付稅金的異常數據欄位",
          "對帳單上蓋有關帳確認章，但稅金金額欄有明顯多溢繳註記"
        ]
      },
      {
        "name": "部門公積金支出備忘錄",
        "frequency": 4,
        "context_snippets": [
          "隨手記在便籤紙上的聚餐費用與雜項開支，未經過正式會計報帳流程",
          "隱藏在抽屜底部的公積金信封，代表合規風險的關鍵象徵物"
        ]
      },
      {
        "name": "任務價值四象限矩陣圖",
        "frequency": 8,
        "context_snippets": [
          "投影幕展示「價值高 vs 價值低」與「緊急 vs 不緊急」的四象限戰略分析圖",
          "Amy以四象限矩陣向學員剖析假性勤奮與真價值的本質差異"
        ]
      },
      {
        "name": "PDCA動態循環滾動看板",
        "frequency": 10,
        "context_snippets": [
          "會議室牆上的磁吸白板，動態展示 Plan-Do-Check-Act 滾動迭代軌跡",
          "彩色便利貼標明各階段突破點，展現持續改善的工匠精神"
        ]
      },
      {
        "name": "自動化排程與標準作業程序手冊",
        "frequency": 7,
        "context_snippets": [
          "厚實精裝的系統作業規範手冊，內含防呆機制與排程演算法流程圖",
          "Tina在平板電腦上向主管展示自動化排程流程圖"
        ]
      },
      {
        "name": "CFT跨部門共同責任承諾清單",
        "frequency": 9,
        "context_snippets": [
          "各部門主管與工程主管聯名簽署的跨部門承諾協議文件",
          "明訂共同承擔KPI、資訊即時同步與資源共享條款"
        ]
      },
      {
        "name": "BOL全球在地化營運藍圖",
        "frequency": 5,
        "context_snippets": [
          "世界地圖上標示海外新廠與在地供應鏈節點的全球戰略摺頁圖冊",
          "展現與夥伴深耕在地、共榮共贏的永續商業生態藍圖"
        ]
      }
    ]
  }
}